<?xml version="1.0"?>
<!DOCTYPE model SYSTEM "model.dtd">
<model path="human.pnm">
  <listmaterials>
    <material path="text_human_1.pnt" />
    <material path="text_human_2.pnt" />
    <material path="text_human_3.pnt" />
  </listmaterials>
  <skeleton path="human.pns" />
  <listanims>
    <anim path="anim_human_1.pna" />
    <anim path="anim_human_2.pna" />
    <anim path="anim_human_3.pna" />
  </listanims>
</model>